q_id,questions,answer
1,我不想要紙本帳單了，想改用手機收簡訊看水費，要去哪裡登記？,可以至台水公司「網路e櫃台」或「E帳單申辦」網頁申請簡訊帳單。需經過手機OTP認證，申請成功後即自當期或下期改採簡訊通知，不再寄送紙本，並享每期水費減免5元優惠。
2,家裡的水龍頭打開有一股像游泳池的味道，這是不是水質有問題？,這是正常現象。自來水在淨水處理過程中會加氯消毒，以符合飲用水水質標準（0.2~1.0毫克/公升）。輕微的消毒水味代表水質是衛生安全的，對人體健康無影響。
3,浴室地板看到紅色的線蟲在動，是自來水管裡面爬出來的嗎？會不會生病？,紅蟲通常是搖蚊科昆蟲的幼蟲，不太可能是從自來水管線侵入（因為有濾網且有餘氯消毒）。紅蟲多半是經由排水管爬上來，或蓄水塔未蓋好導致滋生。建議檢查排水溝並清洗水塔。
4,水費單已經過期幾天了，還可以直接去7-11繳錢嗎？還是要去水公司？,若僅超過繳費期限但還在「代收期限」內（通常是次月21日前），仍可持單至四大超商（統一、全家、OK、萊爾富）繳費。若已超過代收期限，則需至台水營運所繳費。
5,水龍頭流出來的水白白的像牛奶一樣，放一下又變透明，是不是有加什麼化學藥劑？,這是物理現象，與水質無關。主因是管線內壓力變化混入空氣，導致水夾帶大量氣泡看起來呈現白濁色。靜置數秒氣泡消失後就會變回清澈，請安心使用。